YearCensus,LEA,LEAName,AgencyWorker,SWENo,FTE,DoB_year,Age,GenderCurrent,Gender,Ethnicity,Ethnicity_Group,Ethnicity_Compact,QualInst,QualLevel,QualLevelName,StepUpGrad,OrgRole,OrgRoleName,RoleStartDate,StartOrigin,RoleEndDate,LeaverDestination,FTE30,Cases30,ContractWeeks,FrontlineGrad,CFKSSstatus,SeniorityCode,SeniorityName
2020,301,Barking and Dagenham,1,170646f335a0f93ad112764dcd11fe7a4890f08aefb28d1696807e37e882153d,0.0,1975.0,48.0,9.0,not specified (indeterminate; unable to be classified as either male or female),WOTH,Any Other White Background,Any Other White Background,Institution Name,2.0,Postgraduate,0.0,1.0,Senior Manager,2016.0,9.0,2023.0,5.0,,87.0,,1.0,,5,Agency
2020,301,Barking and Dagenham,1,1ce5045eb004aa120117e90a0eb2aea4aa38523be9cedb37d2621bcbcbba329c,0.803122,,,,,WBRI,White - British,White - British,Institution Name,3.0,Other (for example any other qualification),,,,,,,,0.964327,,403.6,0.0,2.0,5,Agency
2020,301,Barking and Dagenham,1,206e97c471f4d5221f8db5aa404d02939e28e13591da37cba903e9f2e1ecc3cd,0.561974,,,,,OOTH,Any Other Ethnic Group,Any Other Ethnic Group,Institution Name,2.0,Postgraduate,0.0,6.0,Qualified without cases,2014.0,4.0,,,0.965936,63.0,,,1.0,5,Agency
2020,301,Barking and Dagenham,1,25f8e1c67c130e33a250ec3216cfe3630c15ffe7fc12066b94d5c90244878c1a,0.786453,1996.0,27.0,0.0,Not known (gender has not been recorded),MWAS,White and Asian,White and Asian,Institution Name,3.0,Other (for example any other qualification),0.0,4.0,Senior Practitioner,2023.0,1.0,,,0.441344,83.0,364.4,1.0,,5,Agency
2020,301,Barking and Dagenham,1,79f9865feea17900c27cf27e98ba15de977887a4844241ed019874259ad7ef6a,0.668266,1983.0,40.0,9.0,not specified (indeterminate; unable to be classified as either male or female),,,,Institution Name,,,1.0,1.0,Senior Manager,2023.0,3.0,,,0.707445,,,1.0,2.0,5,Agency
2020,301,Barking and Dagenham,1,93df82943c4e0757d41565d23ecb26ecd4e146e752cf9a13f80fde8c44cfee47,0.521371,1967.0,56.0,1.0,male,REFU,Declared not stated or Refused,Declared not stated or Refused,Institution Name,,,0.0,,,1988.0,9.0,,,,72.0,288.7,1.0,1.0,5,Agency
2020,301,Barking and Dagenham,1,a0848103de9608a0cf1daf5e0919a81b9eaf1c315bc350348e2a8124d09762fa,0.0,1984.0,39.0,,,APKN,Pakistani,Pakistani,Institution Name,,,0.0,5.0,Case Holder,2014.0,4.0,2023.0,3.0,0.23246,,213.4,0.0,2.0,5,Agency
2020,301,Barking and Dagenham,1,c569dae7a53fce2755b29a979664734b18275c28b7f5817f71b65f5776e04e64,0.192894,1959.0,64.0,0.0,Not known (gender has not been recorded),REFU,Declared not stated or Refused,Declared not stated or Refused,Institution Name,2.0,Postgraduate,1.0,3.0,First Line Manager,1985.0,9.0,,,0.18449,14.0,188.4,0.0,1.0,5,Agency
